<?xml version="1.0" encoding="UTF-8" standalone="yes"?>
<rizpa-stock-exchange-descriptor xmlns:xsi="http://www.w3.org/2001/XMLSchema-instance" xsi:noNamespaceSchemaLocation="SAVED-RSE-V3.xsd">
    <rse-stocks>
        <rse-stock>
            <rse-symbol>GOOGL</rse-symbol>
            <rse-company-name>Google</rse-company-name>
            <rse-price>100</rse-price>
            <rse-data-base>
                <rse-buy-orders/>
                <rse-sell-orders/>
                <rse-successfully-finished-transactions/>
            </rse-data-base>
            <rse-stock-graph-series/>
        </rse-stock>
        <rse-stock>
            <rse-symbol>AAPL</rse-symbol>
            <rse-company-name>Apple</rse-company-name>
            <rse-price>75</rse-price>
            <rse-data-base>
                <rse-buy-orders/>
                <rse-sell-orders/>
                <rse-successfully-finished-transactions/>
            </rse-data-base>
            <rse-stock-graph-series/>
        </rse-stock>
        <rse-stock>
            <rse-symbol>MSFT</rse-symbol>
            <rse-company-name>Microsoft</rse-company-name>
            <rse-price>150</rse-price>
            <rse-data-base>
                <rse-buy-orders/>
                <rse-sell-orders/>
                <rse-successfully-finished-transactions/>
            </rse-data-base>
            <rse-stock-graph-series/>
        </rse-stock>
        <rse-stock>
            <rse-symbol>AMZN</rse-symbol>
            <rse-company-name>AMAZON</rse-company-name>
            <rse-price>275</rse-price>
            <rse-data-base>
                <rse-buy-orders/>
                <rse-sell-orders/>
                <rse-successfully-finished-transactions/>
            </rse-data-base>
            <rse-stock-graph-series/>
        </rse-stock>
    </rse-stocks>
    <rse-users>
        <rse-user name="tal" role="USER">
            <rse-holdings/>
        </rse-user>
    </rse-users>
</rizpa-stock-exchange-descriptor>
